{
  "$schema": "https://json-schema.org/draft/2020-12/schema",
  "$id": "https://ospp-standard.org/schemas/v1/mqtt/boot-notification-response.schema.json",
  "title": "BootNotificationResponse",
  "description": "Server response to a BootNotificationRequest, indicating acceptance, rejection, or pending status along with operational parameters.",
  "type": "object",
  "additionalProperties": false,
  "required": [
    "status",
    "serverTime",
    "heartbeatIntervalSec"
  ],
  "properties": {
    "status": {
      "type": "string",
      "enum": [
        "Accepted",
        "Rejected",
        "Pending"
      ],
      "description": "Result of the boot notification registration."
    },
    "serverTime": {
      "$ref": "../common/timestamp.schema.json",
      "description": "Server UTC timestamp for station clock synchronization."
    },
    "heartbeatIntervalSec": {
      "type": "integer",
      "minimum": 10,
      "maximum": 3600,
      "description": "Interval in seconds at which the station must send heartbeats."
    },
    "retryInterval": {
      "type": "integer",
      "minimum": 1,
      "description": "Seconds to wait before retrying. Required when status is Rejected or Pending."
    },
    "errorCode": {
      "type": "integer",
      "minimum": 1000,
      "maximum": 9999,
      "description": "OSPP error code explaining the rejection. Required when status is Rejected."
    },
    "errorText": {
      "type": "string",
      "pattern": "^[A-Z][A-Z0-9_]+$",
      "maxLength": 64,
      "description": "Machine-readable error name in UPPER_SNAKE_CASE. Required when status is Rejected."
    },
    "configuration": {
      "type": "object",
      "additionalProperties": {
        "type": "string"
      },
      "description": "Key-value configuration pairs pushed to the station. Optional, except that an Accepted response to a station that declares the Offline / BLE profile carries one with the five offline keys (08-configuration.md 8.3); the schema cannot see the station's capabilities and does not enforce it."
    },
    "sessionKey": {
      "type": "string",
      "minLength": 1,
      "maxLength": 1024,
      "description": "Base64-encoded 32-byte HMAC session key. REQUIRED on every Accepted AND every Pending response, unconditionally. Pending is included because a Pending station answers server commands (Chapter 05 section 1.4) and every command is signed -- without a key the server could not send one and the station could not answer, which would close the exact channel the Pending window exists to keep open. Absent on Rejected, which accepts no commands and establishes nothing. It was previously conditional on MessageSigningMode -- which is station configuration, not a field of this message, so the condition was not expressible in JSON Schema and would have stayed prose forever. Under MessageSigningMode None the key is simply unused; issuing one costs 44 bytes and makes the requirement machine-checkable. A station that receives Accepted or Pending WITHOUT it MUST treat the response as malformed (Core profile -- BootNotification section 5.3)."
    },
    "supportedVersions": {
      "type": "array",
      "items": {
        "type": "string",
        "pattern": "^\\d+\\.\\d+\\.\\d+$"
      },
      "minItems": 1,
      "description": "Protocol versions supported by server. Required when Rejected with 1007 PROTOCOL_VERSION_MISMATCH."
    },
    "details": {
      "type": "object",
      "additionalProperties": false,
      "description": "Diagnostic detail for the accompanying errorCode. REQUIRED on a Pending response carrying 3018 TOPOLOGY_MISMATCH, where it MUST name what the server expected and what arrived; absent otherwise. A station held out of service for a reason nobody can see is a station nobody can repair, which is why this is required rather than recommended. Closed, like every other object in this schema set: a future error code that needs its own detail adds its member here, and the protocol is unreleased, so that costs a schema edit and nothing else.",
      "properties": {
        "expected": {
          "type": "array",
          "maxItems": 64,
          "description": "The topology recorded for this station at provisioning, in the same shape as the request's bays[].",
          "items": {
            "$ref": "../common/bay-topology.schema.json"
          }
        },
        "declared": {
          "type": "array",
          "maxItems": 64,
          "description": "The topology this BootNotification declared, echoed back so an operator can compare the two without correlating two messages.",
          "items": {
            "$ref": "../common/bay-topology.schema.json"
          }
        }
      }
    }
  },
  "allOf": [
    {
      "if": {
        "properties": {
          "status": {
            "const": "Rejected"
          }
        },
        "required": [
          "status"
        ]
      },
      "then": {
        "required": [
          "retryInterval",
          "errorCode",
          "errorText"
        ]
      }
    },
    {
      "if": {
        "properties": {
          "status": {
            "const": "Pending"
          }
        },
        "required": [
          "status"
        ]
      },
      "then": {
        "required": [
          "retryInterval"
        ]
      }
    },
    {
      "if": {
        "properties": {
          "status": {
            "enum": [
              "Accepted",
              "Pending"
            ]
          }
        },
        "required": [
          "status"
        ]
      },
      "then": {
        "required": [
          "sessionKey"
        ]
      }
    },
    {
      "if": {
        "properties": {
          "status": {
            "const": "Pending"
          },
          "errorCode": {
            "const": 3018
          }
        },
        "required": [
          "status",
          "errorCode"
        ]
      },
      "then": {
        "required": [
          "errorCode",
          "errorText",
          "details"
        ],
        "properties": {
          "details": {
            "required": [
              "expected",
              "declared"
            ]
          }
        }
      }
    }
  ]
}
