{
  "status": "Accepted",
  "serverTime": "2026-02-13T10:00:00.250Z",
  "heartbeatIntervalSec": 30,
  "configuration": {
    "RevocationEpoch": "42",
    "OfflinePassPublicKey": "MFkwEwYHKoZIzj0CAQYIKoZIzj0DAQcDQgAEgvQlIvxRxGjFmqpueMZYaGB+z/HdgUeQk7sNEWSoWWuQS4tkJH4ZlkMXQfu4k6BG13H7vgYBLutaX0fclQj5vA==",
    "OfflineModeEnabled": "true",
    "OfflineWindowHours": "240",
    "OfflineTransactionLimit": "1000",
    "MaxSessionDurationSeconds": "900",
    "MeterValuesInterval": "60"
  },
  "sessionKey": "dGFwbHktc2Vzc2lvbi1rZXktMjAyNi0wMi0xM1QxMDowMDowMC4wMDBa"
}
